{
  "$comment": "GENERATED by bun nv render — do not edit",
  "$schema": "https://json-schema.org/draft/2020-12/schema",
  "title": "rule",
  "type": "object",
  "properties": {
    "title": {
      "type": "string"
    },
    "status": {
      "enum": [
        "shipped",
        "designed"
      ]
    },
    "seeAlso": {
      "type": "array",
      "items": {
        "type": "string",
        "minLength": 1,
        "x-references": "rule"
      }
    },
    "guardedBy": {
      "type": "array",
      "items": {
        "type": "string"
      }
    },
    "goal": {
      "type": "string",
      "pattern": "^[a-z0-9][a-z0-9-]*$"
    },
    "milestone": {
      "type": "string",
      "minLength": 1,
      "x-references": "milestone"
    }
  },
  "required": [
    "title",
    "status",
    "seeAlso",
    "guardedBy"
  ],
  "additionalProperties": false
}
