{
  "title": "A completion row shows a member's signature after its name and its type at the right, a type its namespace, and the card is read on resolve for one item",
  "status": "shipped",
  "seeAlso": [
    "ide/the-rendering-has-one-home",
    "core-api/reference-card"
  ],
  "guardedBy": [
    "crates/nvs-lsp/tests/completion_edits.rs",
    "tests/lsp/completion/a-core-class-name-offers-its-static-rows-and-its-constants.lspt",
    "tests/lsp/completion/a-class-name-offers-the-static-half-and-a-value-offers-the-other.lspt",
    "tests/lsp/completion/a-bare-name-reaches-a-core-class-by-its-last-segment.lspt"
  ]
}
