{
  "title": "HTML parses by the WHATWG algorithm onto `Core\\Xml`'s own tree, and that parse never fails",
  "status": "shipped",
  "seeAlso": [
    "core-classes/html-sanitize",
    "core-classes/pdf-one-engine",
    "errors/ambiguous-input-refused"
  ],
  "guardedBy": [
    "tests/conformance/core/html-parse-never-fails-and-supplies-what-a-document-left-out.nvst",
    "tests/conformance/core/html-places-misnested-and-stray-content-where-the-algorithm-says.nvst",
    "tests/conformance/core/html-and-xml-are-two-front-doors-onto-one-node-family.nvst",
    "tests/conformance/core/html-and-xml-agree-about-the-tree-of-a-sanitized-document.nvst",
    "tests/conformance/core/xml-a-tree-writes-back-out-as-a-document-that-parses-to-it.nvst",
    "tests/conformance/core/xml-writing-a-tree-refuses-what-the-html-door-recovered-from.nvst",
    "crates/nvs-stdlib/src/html.rs",
    "tests/hostile/core/Html/parse/02-markup-nested-a-hundred-thousand-deep.nvs",
    "tests/hostile/core/Html/parse/03-a-tag-with-two-hundred-thousand-attributes.nvs",
    "tests/hostile/core/Html/sanitize/02-markup-nested-a-hundred-thousand-deep.nvs",
    "tests/hostile/core/Html/sanitize/03-a-tag-with-two-hundred-thousand-attributes.nvs"
  ]
}
