{
  "title": "`HEAD` runs as `GET` with the body discarded and `Content-Length` kept; `method()` reports `Get` and `isHead()` tells the truth",
  "status": "shipped",
  "seeAlso": [
    "http-server/a-preflight-is-answered-before-any-code-runs",
    "http-server/a-trailing-slash-is-never-normalised",
    "routing/matching-is-not-dispatching"
  ],
  "guardedBy": [
    "tests/conformance/core/a-head-request-matches-a-get-route-and-is-head-says-so.nvst"
  ]
}
