{
  "title": "A `// TODO:` comment is a list the editor and `nvs check --todos` print, never a diagnostic, and `nvs check` gains `--deny` and `--fix`",
  "status": "designed",
  "seeAlso": [
    "tooling/doc-comment-is-three-slashes",
    "attributes/a-deprecation-names-its-replacement-as-code",
    "ide/a-code-action-ships-only-a-fix-a-diagnostic-already-knows"
  ],
  "guardedBy": []
}
