{
  "title": "Static serving is one policy in both modes: the exact file, never a listing, one `ETag`, one `Range` checked by `If-Range`, a body streamed from disk, and a `.nvs` file is never served as source",
  "status": "shipped",
  "seeAlso": [
    "http-server/a-request-resolves-in-five-steps",
    "http-server/an-unsafe-or-unbounded-default-is-a-defect"
  ],
  "guardedBy": [
    "crates/nvs-server/src/statics.rs",
    "crates/nvs-server/src/serve.rs"
  ]
}
