{
  "title": "Under `nvs dap` the baseline compiler runs with a debug switch: every local is in a described stack slot and every statement is a stop site",
  "status": "designed",
  "seeAlso": [
    "testing/debug-probes",
    "testing/a-stop-pauses-the-whole-task-tree",
    "ide/the-debug-adapter-does-not-wait-for-an-editor",
    "security/redaction-reaches-the-tools-own-renderings"
  ],
  "guardedBy": [],
  "goal": "debugger-core"
}
