{
  "title": "A `.nvsx` is a single WebAssembly component whose manifest is an `nvs.manifest` custom section",
  "status": "shipped",
  "seeAlso": [
    "packaging/extension-calls-are-statically-typed",
    "security/extension-manifest-only-tightens",
    "config/the-extension-set-is-in-every-unit-key"
  ],
  "guardedBy": [
    "crates/nvs-ext/tests/manifest.rs",
    "crates/nvs-ext/tests/load.rs",
    "crates/nvs-stdlib/tests/ext_world.rs"
  ]
}
