{
  "title": "The benchmark engine list is data, `total` is the CLI headline, and a missing engine never turns a build red",
  "status": "shipped",
  "seeAlso": [
    "testing/userland-benchmarks",
    "tooling/python-claims",
    "programs/three-claims"
  ],
  "guardedBy": [
    "tools/nv/cmd/bench.ts",
    "benches/userland/README.md"
  ]
}
